[
  {
    "id": "WHO_IMR",
    "name": "WHO Indicator Metadata Registry",
    "org": "World Health Organization",
    "url": "https://www.who.int/data/gho/indicator-metadata-registry",
    "access": "HTML catalogue",
    "boundary": "Every English-language indicator link visible in the registry index at the cut-off date",
    "release": "Release 1",
    "status": "Included — source-complete index harvest",
    "observedRecords": 1320,
    "lastChecked": "2026-08-24"
  },
  {
    "id": "WB_HEALTH",
    "name": "World Bank Health Indicators",
    "org": "World Bank",
    "url": "https://api.worldbank.org/v2/topic/8/indicator",
    "access": "Indicators API",
    "boundary": "Every indicator returned under World Bank topic 8 (Health)",
    "release": "Release 1",
    "status": "Included — source-complete API harvest",
    "observedRecords": 658,
    "lastChecked": "2026-08-24"
  },
  {
    "id": "UN_SDG",
    "name": "UN Global SDG Indicator Framework",
    "org": "United Nations Statistics Division",
    "url": "https://unstats.un.org/SDGAPI/v1/sdg/Indicator/List",
    "access": "SDG API",
    "boundary": "Every indicator currently published in the official global framework; repeated target placements retained by the source",
    "release": "Release 1",
    "status": "Included — source-complete API harvest",
    "observedRecords": 251,
    "lastChecked": "2026-08-24"
  },
  {
    "id": "UNICEF_DW",
    "name": "UNICEF Indicator Data Warehouse",
    "org": "UNICEF",
    "url": "https://sdmx.data.unicef.org/ws/public/sdmxapi/rest/dataflow/all/GLOBAL_DATAFLOW/latest/",
    "access": "SDMX API",
    "boundary": "Every code in CL_UNICEF_INDICATOR used by the GLOBAL_DATAFLOW structure",
    "release": "Release 1",
    "status": "Included — source-complete SDMX codelist harvest",
    "observedRecords": 799,
    "lastChecked": "2026-08-24"
  },
  {
    "id": "PRIORITY",
    "name": "Curated Priority Public Health Collection",
    "org": "Multi-source synthesis",
    "url": "./downloads/research-synthesis.md",
    "access": "Curated research dataset",
    "boundary": "The 80 previously validated priority records; retained as a separate collection",
    "release": "Release 1",
    "status": "Included — curated collection",
    "observedRecords": 80,
    "lastChecked": "2026-08-24"
  },
  {
    "id": "WHO_CORE100",
    "name": "WHO Global Reference List of 100 Core Health Indicators",
    "org": "World Health Organization",
    "url": "https://www.who.int/publications/i/item/2018-global-reference-list-of-100-core-health-indicators-(plus-health-related-sdgs)",
    "access": "PDF",
    "boundary": "All listed core indicators and health-related SDGs",
    "release": "Release 2",
    "status": "Crosswalk pending; many concepts represented in Release 1 sources",
    "observedRecords": 0,
    "lastChecked": "2026-08-24"
  },
  {
    "id": "OECD_HEALTH",
    "name": "OECD Health Statistics",
    "org": "OECD",
    "url": "https://www.oecd.org/en/data/datasets/oecd-health-statistics.html",
    "access": "OECD Data Explorer / SDMX",
    "boundary": "All active OECD Health Statistics series",
    "release": "Release 2",
    "status": "Pending source-specific extraction",
    "observedRecords": 0,
    "lastChecked": "2026-08-24"
  },
  {
    "id": "EU_ECHI",
    "name": "European Core Health Indicators",
    "org": "European Commission",
    "url": "https://health.ec.europa.eu/indicators-and-data/european-core-health-indicators-echi_en",
    "access": "Web and downloads",
    "boundary": "All active ECHI indicators",
    "release": "Release 2",
    "status": "Pending source-specific extraction",
    "observedRecords": 0,
    "lastChecked": "2026-08-24"
  },
  {
    "id": "PAHO_PLISA",
    "name": "PAHO Core Indicators / PLISA",
    "org": "PAHO/WHO",
    "url": "https://opendata.paho.org/en/core-indicators",
    "access": "Web/API",
    "boundary": "All active regional core indicators",
    "release": "Release 2",
    "status": "Pending source-specific extraction",
    "observedRecords": 0,
    "lastChecked": "2026-08-24"
  },
  {
    "id": "JMP",
    "name": "WHO/UNICEF Joint Monitoring Programme",
    "org": "WHO and UNICEF",
    "url": "https://washdata.org/monitoring",
    "access": "Downloads",
    "boundary": "All household, school and facility WASH indicators",
    "release": "Release 2",
    "status": "Pending source-specific extraction",
    "observedRecords": 0,
    "lastChecked": "2026-08-24"
  },
  {
    "id": "UNAIDS",
    "name": "UNAIDS Indicator Registry / Global AIDS Monitoring",
    "org": "UNAIDS",
    "url": "https://indicatorregistry.unaids.org/",
    "access": "Web/reporting tool",
    "boundary": "All current GAM and registry indicators",
    "release": "Release 2",
    "status": "Pending source-specific extraction",
    "observedRecords": 0,
    "lastChecked": "2026-08-24"
  },
  {
    "id": "WHO_GLASS",
    "name": "WHO GLASS",
    "org": "World Health Organization",
    "url": "https://www.who.int/initiatives/glass",
    "access": "Reports and downloads",
    "boundary": "All standardized AMR and antimicrobial-use indicators",
    "release": "Release 2",
    "status": "Pending source-specific extraction",
    "observedRecords": 0,
    "lastChecked": "2026-08-24"
  },
  {
    "id": "ILOSTAT_OSH",
    "name": "ILOSTAT Occupational Safety and Health",
    "org": "International Labour Organization",
    "url": "https://rshiny.ilo.org/dataexplorer/",
    "access": "Bulk download / SDMX",
    "boundary": "All active occupational safety and health indicators",
    "release": "Release 2",
    "status": "Pending source-specific extraction",
    "observedRecords": 0,
    "lastChecked": "2026-08-24"
  },
  {
    "id": "WHO_SCORE",
    "name": "WHO SCORE for Health Data",
    "org": "World Health Organization",
    "url": "https://www.who.int/data/data-collection-tools/score",
    "access": "Reports and portal",
    "boundary": "All SCORE assessment indicators",
    "release": "Release 2",
    "status": "Pending source-specific extraction",
    "observedRecords": 0,
    "lastChecked": "2026-08-24"
  },
  {
    "id": "CIHI",
    "name": "CIHI Indicator Library",
    "org": "Canadian Institute for Health Information",
    "url": "https://www.cihi.ca/en/access-data-and-reports/indicator-library",
    "access": "Web/downloads",
    "boundary": "All current Canadian indicator records",
    "release": "National extensions",
    "status": "Out of Release 1 global boundary",
    "observedRecords": 0,
    "lastChecked": "2026-08-24"
  },
  {
    "id": "AHRQ",
    "name": "AHRQ Healthcare Quality Indicators",
    "org": "US HHS/AHRQ",
    "url": "https://qualityindicators.ahrq.gov/",
    "access": "Web/downloads",
    "boundary": "All current AHRQ quality indicators",
    "release": "National extensions",
    "status": "Out of Release 1 global boundary",
    "observedRecords": 0,
    "lastChecked": "2026-08-24"
  },
  {
    "id": "CDC_PLACES",
    "name": "CDC PLACES",
    "org": "US CDC",
    "url": "https://www.cdc.gov/places/",
    "access": "API/downloads",
    "boundary": "All current PLACES measures",
    "release": "National extensions",
    "status": "Out of Release 1 global boundary",
    "observedRecords": 0,
    "lastChecked": "2026-08-24"
  },
  {
    "id": "FINGERPRINTS",
    "name": "England Public Health Outcomes Framework / Fingertips",
    "org": "Office for Health Improvement and Disparities",
    "url": "https://fingertips.phe.org.uk/",
    "access": "API/downloads",
    "boundary": "All current Fingertips indicators",
    "release": "National extensions",
    "status": "Out of Release 1 global boundary",
    "observedRecords": 0,
    "lastChecked": "2026-08-24"
  },
  {
    "id": "IHME_GBD",
    "name": "IHME Global Burden of Disease Results",
    "org": "IHME",
    "url": "https://vizhub.healthdata.org/gbd-results/",
    "access": "Account-mediated downloads",
    "boundary": "All published GBD measures, causes and risks represented as versioned concepts",
    "release": "Release 2",
    "status": "Pending licence-appropriate extraction",
    "observedRecords": 0,
    "lastChecked": "2026-08-24"
  },
  {
    "id": "IND_HMIS_OGD",
    "name": "India Health Management Information System (HMIS)",
    "org": "Ministry of Health and Family Welfare, Government of India",
    "url": "https://nhm.hp.gov.in/reporting-formats",
    "access": "Public forms, NHSRC training materials, OGD catalogues and live portal",
    "boundary": "54 historical formula-defined indicators linked to a separate 700-element April-2025 form dictionary, 202 OGD outputs and 25 validation rules",
    "release": "India extension - HMIS linked knowledge Release 1.3",
    "status": "Included - public-source-bounded linked structure; current live dictionary/validation export pending",
    "observedRecords": 54,
    "lastChecked": "2026-09-01"
  },
  {
    "id": "IND_NHM_RMNCHA",
    "name": "NHM RMNCH+A, RCH, RBSK and RKSK indicator sets",
    "org": "National Health Mission, MoHFW",
    "url": "https://nhm.gov.in/",
    "access": "Guidelines, reports and programme MIS",
    "boundary": "Official maternal, newborn, child, adolescent, reproductive-health and nutrition programme indicators",
    "release": "India Programme 2 — RMNCH+A",
    "status": "Expanded — three source tables complete; portal and newer-manual gaps declared",
    "observedRecords": 169,
    "lastChecked": "2026-09-03"
  },
  {
    "id": "IND_NHM_UIP",
    "name": "Universal Immunization Programme and Mission Indradhanush indicators",
    "org": "National Health Mission, MoHFW",
    "url": "https://nhm.gov.in/New_Updates_2018/NHM_Components/Immunization/Guildelines_for_immunization/Mission_Indradhanush_Guidelines.pdf",
    "access": "Operational guidelines and monitoring formats",
    "boundary": "Routine immunization, campaign, cold-chain and AEFI monitoring indicators",
    "release": "India extension — Release 1",